filename,label,date,author,title,url,body
news_2025_dec_04_garden-ponds-provide-vital-habitats-and-a-revival-is-under-way-in-britain.txt,news,2025-12-04,Kate Ravilious,Garden ponds provide vital habitats – and a revival is under way in Britain,https://www.theguardian.com/news/2025/dec/04/garden-ponds-provide-vital-habitats-and-a-revival-is-under-way-in-britain,"A few years ago I created a little pond in my back garden. It’s barely bigger than a paving slab, but since the pond has been in place we have had a garden teeming with frogs, hedgehogs have taken up residence and bird life has abounded. Not only do humble ponds like this give nature a boost; they also help to buffer climate extremes. In recent decades, Britain’s ponds have been disappearing, with research revealing that more than half of our dense network of ponds has been lost since the 1900s. Lucy Clarke and colleagues found that 58% of ponds in the Severn Vale region of the UK had been lost since the 1900s, with the average distance between ponds increasing by 25 metres over that time. Similar trends can be seen worldwide, with intensive agriculture and urbanisation obliterating these seemingly insignificant bodies of water. But now a pond revival is under way, with even tiny ponds such as mine helping to create biodiversity hotspots, plus provide cooling during heatwaves and help to slow the flow of water during heavy rains, reducing pressure on our overloaded drains and recharging parched groundwater reservoirs. Previously overlooked, ponds large and small are starting to be recognised as a vital habitat and a small but mighty climate mitigation tool."
news_2025_dec_04_record-numbers-becoming-billionaires-through-inheritance-ubs-report-finds.txt,news,2025-12-04,Lauren Almeida,"Record numbers becoming billionaires through inheritance, UBS report finds",https://www.theguardian.com/news/2025/dec/04/record-numbers-becoming-billionaires-through-inheritance-ubs-report-finds,"The super-rich are inheriting record levels of wealth as they pass down billions of dollars to their children, grandchildren and spouses, research by a Swiss bank favoured by billionaires shows. Globally, there are 2,919 billionaires this year, up from 2,682 in 2024, UBS found. Of these, 91 people this year became billionaires through inheritance, collectively receiving $298bn (£223bn) in the 12 months to April, the bank said. That was up more than a third against last year and the highest since UBS started its research in 2015. Among them are the six grandchildren of the late Asian paint tycoon Goh Cheng Liang, who died in Singapore in August aged 98. Each grandchild inherited stakes in a public company worth more than $1bn, according to reports. Meanwhile, 196 “self-made” entrepreneurs became billionaires this year, with a collective wealth of $386.5bn, UBS said. Benjamin Cavalli, an executive at the bank, said the increase in billionaire inheritance was proof of a “multi-year wealth transfer that’s intensifying”, with this group expected to inherit at least $5.9tn in the next 15 years. Most of the inheritance is expected to come from the US, followed by India, France, Germany and Switzerland. The UK ranked seventh, with $164bn in wealth expected to be passed down over the next 15 years. However, this could change as footloose billionaires move around the world, motivated by a better quality of life, geopolitical concerns and tax considerations, UBS found. Various European governments have faced calls to introduce a wealth tax on the international elite this year. In Switzerland, where UBS estimates that $206bn will be inherited over the next 15 years, voters on Sunday overwhelmingly rejected a proposed 50% tax on inherited fortunes of £47m or more. In October, the French parliament voted against a proposed 2% tax on fortunes over €100m. Italy, which has attracted many wealthy residents thanks to its flat-tax regime for foreign income, has set out plans to increase the levy by 50% to €300,000 a year from 2026. Meanwhile, the UK, which distanced itself from reports of a formal wealth tax over the summer, officially ended non-dom status this year under which UK residents who declared their permanent home as overseas could avoid paying UK tax on foreign income and gains. It also announced plans for a council tax surcharge, labelled a “mansion tax”, on homes worth more than £2m in last week’s budget. Last year, Spain, Brazil, Germany and South Africa signed a motion at the G20 for a minimum 2% tax on the super-rich to reduce inequality and raise public funds. Forecasts on its impact vary, but a study by the leading French economist Gabriel Zucman found it could net up to $250bn in extra revenue. The four countries have called on other governments to support the campaign, saying a levy on the ultra-wealthy would complement negotiations on the taxation of the digital economy and continuing efforts to bring in a global minimum corporate tax of 15% for multinational businesses. • This article was amended on 4 December 2025. Because of an error in the UBS report, an earlier version said there are 9,919 billionaires around the world this year. This figure has been corrected to 2,919."
news_2025_dec_05_the-crunch-voting-in-victoria-gambling-in-a-crypto-casino-and-the-sex-lives-of-gen-z.txt,news,2025-12-05,Josh Nicholas and Nick Evershed,The Crunch: voting in Victoria; gambling in a crypto casino; and the sex lives of gen Z,https://www.theguardian.com/news/2025/dec/05/the-crunch-voting-in-victoria-gambling-in-a-crypto-casino-and-the-sex-lives-of-gen-z,"Hello and welcome to another edition of The Crunch! In this week’s newsletter we have charts on the revenue required to pay for all this AI infrastructure, how natural disasters are distorting the US home insurance market, and how much little sex gen Z is having. But first … whither group voting tickets? In Australia, Victoria is the last state still using group voting tickets (GVTs) to elect its upper house. This is where voters can vote “above the line” for a party, which then gets to decide where the vote goes after the party’s candidates are eliminated. GVTs have long been exploited, with backroom deals between parties allowing little-known candidates to leapfrog rivals who received far, far more primary votes. As happened in 2018: With Victoria’s electoral matters committee recommending group voting tickets be abolished this week, we took a deep dive into what exactly they are, and what the various options are to replace them and reform the system. Four charts from the fortnight *** 1. An incredible loss Julian Fell and Georgina Piper at the ABC have a devastating story of a man who lost more than US$180k gambling in a crypto casino, including more than US$40k in just eight days: Content warning: the ABC story contains references to suicide. Elsewhere the ABC also had this dire story about rental affordability and some nice charts using the latest wave of the Australian Election Study. *** 2. Harder and harder to insure In 2020, about 222,000 Californian homes were covered by state-run or state-backed insurers of “last resort” as private companies wouldn’t cover them. With many of these homes increasingly prone to natural disasters, that number jumped by more than 100,000 in 2023. Reuters have a wonderfully designed visual story looking at how climate change is driving this trend and how these non-profit insurers may be feeding a vicious cycle. *** 3. Stacks on stacks on stacks There’s been a rich vein of charts looking at the “AI bubble” recently, but this one from the Washington Post really caught our attention: It’s not just because its a bar chart – The Crunch’s chart of choice. But that, according to JP Morgan, the tech industry will need an extra US$650bn in revenue every year just to earn a 10% return on all this investment. For context, Google’s 2024 revenue was US$350bn and OpenAI has annual revenues of about US$20bn. *** 4. More distribution charts, please A lot of fancy graphics focus on means and medians and other summary stats, hiding all the nuance of the actual distribution of the data. There’s a great exception in this story from Works in Progress: Really recommend a click through to this fascinating story about how English is becoming easier to read. Bonus: there’s a scatterplot! Bookmarks The Guardian, CNN, Straits Times and Reuters all made visual guides on the Hong Kong apartment fires Pie charts from the 1940s How critical minerals power our daily lives The latest in Robert Simon’s gentle introduction to GDAL series An interactive explainer on the World Bank’s Statistical Performance Indicators Bloomberg made a graphic novel ($) Off the Charts Our colleague and perennial Crunch favourite Mona Chalabi has a bunch of beautiful charts and stats on the sex lives of (American) gen Z-ers: There is a lot in this article, from one-night stands to monogamy and even politics. Sign up If you would like to receive The Crunch to your email inbox every fortnight, sign up here."
news_2025_dec_05_weather-watch-everyday-phrases-nautical-expressions-wind-language.txt,news,2025-12-05,David Hambling,‘Three sheets to the wind’: how everyday phrases blew in from the sea,https://www.theguardian.com/news/2025/dec/05/weather-watch-everyday-phrases-nautical-expressions-wind-language,"Some everyday expressions have an obvious nautical origin such as “all at sea” and “an even keel”. But plenty of others have slipped into the language unnoticed, including a number derived from how sailors talked about the wind. Surprisingly, “overbearing” was originally a nautical term, meaning having an advantage over another ship by carrying more canvas safely and so being able to sail faster. The expression came to be used metaphorically to describe an approaching storm or anything else that could not be outrun. Similarly to “bear down” on something was to approach forcefully with the wind behind. “Veering”, from the French “virer”, meaning to turn, was first applied to the change in direction of the wind. Specifically, it means a movement clockwise. A wind that shifts anticlockwise, say from north to west, is “backing” rather than veering. “By and large” originally referred to a ship alternately sailing as close to the wind as possible, known as sailing “by the wind”, and sailing in the direction the wind is blowing in. The expression came to mean under most conditions, or in general. These expressions are amphibians that have moved from the sea to exist on land, leaving behind all traces of the ocean winds and making themselves at home in suburbia."
commentisfree_2025_dec_04_the-guardian-view-on-regulating-pornography-a-1m-fine-does-not-prove-the-online-safety-act-is-working.txt,opinion,2025-12-04,Editorial,The Guardian view on regulating pornography: a £1m fine does not prove the Online Safety Act is working,https://www.theguardian.com/commentisfree/2025/dec/04/the-guardian-view-on-regulating-pornography-a-1m-fine-does-not-prove-the-online-safety-act-is-working,"Awareness of the harm caused by online pornography is rising. Last month, the government bowed to pressure from campaigners and pledged to make depictions of strangulation illegal. Research showing that a majority of children have viewed this kind of material is extremely disturbing, all the more so given evidence that viewing “choking” makes people – mostly men – more likely to do it in real life. This week, the Guardian examined the distressing effects of deepfake pornography in schools, and interviewed the women behind the successful campaign to criminalise the nonconsensual creation of deepfake intimate images. Ofcom’s announcement that it has issued a £1m fine to a Belize-based pornography company, AVS Group, thus seems timely. Oliver Griffiths, the regulator’s director of online safety, referred on BBC radio to a “tide turning” as enforcement powers in the Online Safety Act take effect. The age-verification checks on AVS’s websites, introduced to protect children, are judged not to be effective enough. If the company does not pay up, Mr Griffiths said that he would move to block the site. One thing everyone connected with online regulation agrees on is that technology is moving at an incredible rate. The danger is that societies, and the systems we use to manage risks, can’t keep up. While it is good to see Ofcom taking action, it is alarming that 90 other companies – 83 of which run pornography sites – are also being investigated, with further fines said to be imminent. Liz Kendall, the technology secretary, warned last month that the regulator was in danger of losing public trust if it did not up the pace of implementation of the Online Safety Act and get on top of emerging threats. Regulation and enforcement in the online space is complicated. When Ofcom issued a £20,000 fine to the controversial forum 4chan, the companies behind it and another forum, Kiwi Farms, filed a legal case. They want a US court to rule that the UK’s online safety laws and codes of conduct do not apply to them. Such challenges make Ofcom’s task harder. But it must not be cowed. Campaigners such as Ian Russell, whose daughter Molly took her own life after viewing harmful material, are right to highlight the moral imperative to make the internet safer for children. They want a new “duty of candour” for public officials to apply to tech companies too, and for the regulator to be more proactive and less passive. This is all made even more urgent by emerging concerns about agentic AI, or chatbots, which stand accused of acting as “suicide coaches” in several US lawsuits. If Ms Kendall believes that there are gaps in current online safety laws, as she said on Wednesday, she must close them. Beeban Kidron, the crossbench peer and online safety campaigner, has laid amendments to the government’s crime and policing bill that would achieve this. Ministers should not drag their heels, as happened with deepfake images. Online safety is not the only area in which Ofcom is accused of damaging inaction. It has also appeared reluctant to tackle racism and misinformation about climate policy on GB News. Regulatory oversight of news and other media have always been important. But in our age of pocket computers, shape-shifting tech and political polarisation, questions about Ofcom’s performance – particularly in relation to children – have arguably never been more pressing."
commentisfree_2025_dec_04_the-guardian-view-on-the-crown-estate-inquiry-a-necessary-probe-and-a-wider-debate.txt,opinion,2025-12-04,Editorial,The Guardian view on the crown estate inquiry: a necessary probe and a wider debate,https://www.theguardian.com/commentisfree/2025/dec/04/the-guardian-view-on-the-crown-estate-inquiry-a-necessary-probe-and-a-wider-debate,"Everyone in Britain has views about the royal family. In many cases, lots of views. Britain’s parliament, however, never lets the subject pass its lips. By long tradition, the House of Commons prohibits itself from any mention, let alone any discussion, of the monarchy or the royal family. This self-imposed gag – in which a centuries-old constitutional monarchy is unable to discuss constitutional monarchy – is infantilising and indefensible. The gag may, however, be loosening. This week, the Commons public accounts committee announced an inquiry into the crown estate. The probe is a direct response to news that the disgraced former Prince Andrew (now Andrew Mountbatten-Windsor) and his brother Prince Edward have been paying “peppercorn rents” for very extensive properties owned by the estate. It is an extremely unusual move in the modern era. The crown estate is a public body, established by statute in 1961. It is independent of both monarch and government. It is also a highly successful and profitable property company worth an estimated £15.5bn. Since David Cameron abolished the civil list system in 2011, the crown gets a generous and protected “sovereign grant” from the estate’s profits each year. As the estate gets a cut of all offshore wind development, among other things, the sovereign grant has provided a royal windfall that might have gone to the Treasury. The grant is due for review in 2026. It should be part of the new inquiry. Royal finances are an entirely legitimate subject for full parliamentary accountability, and the kind of scrutiny advocated in the Guardian’s Cost of the crown series. As the Treasury accepted last week in a letter to the committee chair, Sir Geoffrey Clifton-Brown, the estate commissioners have “a statutory duty to maintain and enhance the value of the estate and the returns obtained from it”. In other words, as Sir Geoffrey had earlier informed the Treasury, the estate must provide “value for money”. The committee is therefore doing its job by inquiring whether this is happening. Its findings are likely to generate great public interest, and rightly so. Value for money is a yardstick that inescapably unlocks the wider debate that parliament ought to routinely be holding about the appropriate workings of the monarchy. The inquiry is doubtless unwelcome for Buckingham Palace. But the announcement this week – a week in which David Dimbleby also began a strikingly sceptical BBC One series entitled What’s the Monarchy For? – may be a sign that times are changing for the crown. That is partly because of changing attitudes. More specifically, it is also because the inquiry should lift a stone on the as yet unpublicised terms under which “grace and favour” residences were, and are, allocated. In addition, it should reveal the terms and responsibilities for ensuring their upkeep. This may mean further unwelcome stories for Mr Mountbatten-Windsor and for the palace. The committee should not flinch from this task out of misplaced deference. Value for money is a proper and powerful tool of public accountability, whether applied to the NHS or to the monarchy. As the former Liberal Democrat minister Norman Baker has argued, the thoroughness of the inquiry will be judged in part by whether it can clarify the number of royal grace-and-favour residences and their costs. According to Mr Baker, in 1993, the last year for which he was able to discover a figure for such residences, there were 272. By contrast, the number of “working” royals stands at 11. Do you have an opinion on the issues raised in this article? If you would like to submit a response of up to 300 words by email to be considered for publication in our letters section, please click here."
