filename,label,date,author,title,url,body
commentisfree_2025_dec_05_agriculture-revolution-soil-farming-earth-rover-program.txt,opinion,2025-12-05,George Monbiot,"Over a pint in Oxford, we may have stumbled upon the holy grail of agriculture",https://www.theguardian.com/commentisfree/2025/dec/05/agriculture-revolution-soil-farming-earth-rover-program,"It felt like walking up a mountain during a temperature inversion. You struggle through fog so dense you can scarcely see where you’re going. Suddenly, you break through the top of the cloud, and the world is laid out before you. It was that rare and remarkable thing: a eureka moment. For the past three years, I’d been struggling with a big and frustrating problem. In researching my book Regenesis, I’d been working closely with Iain Tolhurst (Tolly), a pioneering farmer who had pulled off something extraordinary. Almost everywhere, high-yield farming means major environmental harm, due to the amount of fertiliser, pesticides and (sometimes) irrigation water and deep ploughing required. Most farms with apparently small environmental impacts produce low yields. This, in reality, means high impacts, as more land is needed to produce a given amount of food. But Tolly has found the holy grail of agriculture: high and rising yields with minimal environmental harm. He uses no fertiliser, no animal manure and no pesticides. His techniques, the result of decades of experiment and observation, appear to enrich the crucial relationships between crops and microbes in the soil, through which soil nutrients must pass. It seems that Tolly has, in effect, “trained” his soil bacteria to release nutrients when his crops require them (a process called mineralisation), and lock them up when his crops aren’t growing (immobilisation), ensuring they don’t leach from the soil. So why the frustration? Well, Tolly has inspired many other growers to attempt the same techniques. Some have succeeded, with excellent results. Others have not. And no one can work out why. It’s likely to have something to do with soil properties. But what? Not for the first time, I had stumbled into a knowledge gap so wide that humanity could fall through it. Soil is a fantastically complex biological structure, like a coral reef, built and sustained by the creatures that inhabit it. It supplies 99% of our calories. Yet we know less about it than any other identified ecosystem. It’s almost a black box. Many brilliant scientists have devoted their lives to its study. But there are major barriers. Most soil properties cannot be seen without digging, and if you dig a hole, you damage the structures you’re trying to investigate. As a result, studying even basic properties is cumbersome, time-consuming and either very expensive or simply impossible at scale. To measure the volume of soil in a field, for example, you need to take hundreds of core samples. But as soil depths can vary greatly from one metre to the next, your figure relies on extrapolation. This makes it very hard to tell whether you’re losing soil or gaining it. Measuring bulk density (the amount of soil in a given volume, which shows how compacted it might be), or connected porosity (the tiny catacombs created by lifeforms, a crucial measure of soil health), or soil carbon – at scale – is even harder. So farmers must guess. Partly because they cannot see exactly what the soil needs, many of their inputs – fertilisers, irrigation, deep ploughing – are wasted. Roughly two-thirds of the nitrogen fertiliser they apply, and between 50% and 80% of their phosphorus, is lost. These lost minerals cause algal blooms in rivers, dead zones at sea, costs for water users and global heating. Huge amounts of irrigation water are also wasted. Farmers sometimes “subsoil” their fields – ploughing that is deep and damaging – because they suspect compaction. The suspicion is often wrong. Our lack of knowledge also inhibits the development of a new agriculture, which may, as Tolly has done, allow farmers to replace chemical augmentation with biological enhancement. So when I came to write the book, I made a statement so vague that it reads like an admission of defeat: we needed to spend heavily on “an advanced science of the soil”, and use it to deliver a “greener revolution”. While we know almost nothing about the surface of our own planet, billions are spent on the Mars Rover programme, exploring the barren regolith there. What we needed, I argued, is an Earth Rover programme, mapping the world’s agricultural soils at much finer resolution. I might as well have written “something must be done!” The necessary technologies simply did not exist. I sank into a stygian gloom. * * * At the same time, Tarje Nissen-Meyer, then a professor of geophysics at the University of Oxford, was grappling with a different challenge. Seismology is the study of waves passing through a solid medium. Thanks to billions from the oil and gas industry, it has become highly sophisticated. Tarje wanted to use this powerful tool for the opposite purpose – ecological improvement. Already, with colleagues, he had deployed seismology to study elephant behaviour in Kenya. Not only was it highly effective, but his team also discovered it could identify animal species walking through the savannah by their signature footfall. By luck we were both attached, in different ways, to Wolfson College, Oxford, where we met in February 2022. I saw immediately that he was a thoughtful man – a visionary. I suggested a pint in The Magdalen Arms. I explained my problem, and we talked about the limits of existing technologies. Was seismology being used to study soil, I asked. He’d never heard of it. “I guess it’s not a suitable technology then?” No, he told me, “soil should be a good medium for seismology. In fact, we need to filter out the soil noise when we look at the rocks.” “So if it’s noise, it could be signal?” “Definitely.” We stared at each other. Time seemed to stall. Could this really be true? Over the next three days, Tarje conducted a literature search. Nothing came up. I wrote to Prof Simon Jeffery, an eminent soil scientist at Harper Adams University, whose advice I’d found invaluable when researching the book. I set up a Zoom call. He would surely explain that we were barking up the wrong tree. Simon is usually a reserved man. But when he had finished questioning Tarje, he became quite animated. “All my life I’ve wanted to ‘see’ into the soil,” he said. “Maybe now we can.” I was introduced to a brilliant operations specialist, Katie Bradford, who helped us build an organisation. We set up a non-profit called the Earth Rover Program, to develop what we call “soilsmology”; to build open-source hardware and software cheap enough to be of use to farmers everywhere; and to create, with farmers, a global, self-improving database. This, we hope, might one day incorporate every soil ecosystem: a kind of Human Genome Project for the soil. We later found that some scientists had in fact sought to apply seismology to soil, but it had not been developed into a programme, partly because the approaches used were not easily scalable. My role was mostly fixer, finding money and other help. We received $4m (£3m) in start-up money from the Bezos Earth Fund. This may cause some discomfort, but our experience has been entirely positive: the fund has helped us do exactly what we want. We also got a lot of pro-bono help from the law firm Hogan Lovells. Tarje, now at the University of Exeter, and Simon began assembling their teams. They would need to develop an ultra-high-frequency variant of seismology. A big obstacle was cost. In 2022, suitable sensors cost $10,000 (£7,500) apiece. They managed to repurpose other kit: Tarje found that a geophone developed by a Slovakian experimental music outfit worked just as well, and cost only $100. Now one of our scientists, Jiayao Meng, is developing a sensor for about $10. In time, we should be able to use the accelerometers in mobile phones, reducing the cost to zero. As for generating seismic waves, we get all the signal we need by hitting a small metal plate with a welder’s hammer. On its first deployment, our team measured the volume of a peat bog that had been studied by scientists for 50 years. After 45 minutes in the field, they produced a preliminary estimate suggesting that previous measurements were out by 20%. Instead of extrapolating the peat depth from point samples, they could see the wavy line where the peat met the subsoil. The implications for estimating carbon stocks are enormous. We’ve also been able to measure bulk density at a very fine scale; to track soil moisture (as part of a wider team); to start building the AI and machine learning tools we need; and to see the varying impacts of different agricultural crops and treatments. Next we’ll work on measuring connected porosity, soil texture and soil carbon; scaling up to the hectare level and beyond; and on testing the use of phones as seismometers. We now have further funding, from the UBS Optimus Foundation, hubs on three continents and a big international team. Eventually, we hope, any farmer anywhere, rich or poor, will be able to get an almost instant readout from their soil. As more people use the tools, building the global database, we hope these readouts will translate into immediate useful advice. The tools should also revolutionise soil protection: the EU has issued a soil-monitoring law, but how can it be implemented? Farmers are paid for their contributions “to improve soil health and soil resilience”, but what this means in practice is ticking a box on a subsidy form: there’s no sensible way of checking. We’re not replacing the great work of other soil scientists but, developing our methods alongside theirs, we believe we can fill part of the massive knowledge gap. As one of the farmers we’re working with, Roddy Hall, remarks, the Earth Rover Program could “take the guesswork out of farming”. One day it might help everyone arrive at that happy point: high yields with low impacts. Seismology promises to shake things up. George Monbiot is a Guardian columnist"
commentisfree_2025_dec_05_great-european-bake-off-eu-closer-integration-pop-culture.txt,opinion,2025-12-05,Paula Erizanu,"The Great European Bake-Off: if the EU wants closer integration, how about using pop culture?",https://www.theguardian.com/commentisfree/2025/dec/05/great-european-bake-off-eu-closer-integration-pop-culture,"It was both enjoyable and strange to see the EU enlargement commissioner, Marta Kos, present the news on Moldovan TV a couple of months ago. For one thing, she is Slovenian – and she is also a diplomat, not a news anchor. But there she was, announcing that Moldova had made more progress in the last three years than it had in the previous 30, and that negotiations for our country to join the European Union would open soon. It was equally surprising to spot Kos in the Instagram stories of leading Moldovan influencer siblings Emilian and Nina Crețu at the end of August – she had invited them to her house in Brussels for a Moldovan pie-making workshop. Kos even brought together the two heads of Moldova’s biggest Orthodox churches for a meeting, in spite of their mutual animosity. This is not the way we are used to EU officials communicating. The departure from stiff, technocratic speeches is part of EU efforts to involve civil society and the public in the EU’s next enlargement process – a difference from the last phase of expansion, from 2004 to 2013, where only the political elites were involved. If the EU is to create a more harmonious kind of European integration, it needs to meet its citizens on the terrain of everyday life like this. In candidate countries such as Albania, Montenegro and Moldova, EU membership feels like a lifeline. But becoming a member is also an arduous, technical process full of reports and negotiation clusters – it is not easy to make it sexy. In the western Balkans, the process has already been going on for years. At the first meeting of a new EU Enlargement Forum in Brussels in November, the Albanian prime minister, Edi Rama, observed that he had been talking about EU accession for so long that he could track the process in the anatomy of his receding hairline. More than 90% of Albanians are keen to join the EU, while in Moldova the figure has varied between 53% and 65% throughout the years. For the majority of Moldovans, EU integration promises peace, prosperity, the rule of law and hope that their children could have a better future. The fears of EU-sceptic Moldovans, rooted in unease about the unknown, are boosted by Russian propaganda saying that EU membership means the loss of tradition, identity and sovereignty, or that local companies will not be able to compete against European giants. One other Kremlin-coined narrative is that the EU is about to collapse, just as the USSR did in 1991, or that the EU simply does not want to integrate Moldova. Why would it need a country of 2.4 million people? In the EU itself, enlargement is probably not especially on the minds of ordinary citizens. Overall, 56% of people within the EU said they believe their country would benefit from further enlargement. Tellingly, the same Eurobarometer survey found about two-thirds of EU citizens said they did not feel well informed about the process. Among their concerns, migration was at the top. With an ageing population, the EU continues to need more migrant workers: a labour force often drawn from poorer EU members or candidate states. If we are going to create a more perfect union, we cannot see these people as mere economic units, just human resources to be exploited. If the EU wants the free movement of people to lead to genuine cultural exchanges and human connections, and to stronger European identity and solidarity, it must ensure workers have help to learn the language of their host countries. It is hard to feel fully comfortable living in a country where you don’t speak the language. One theory about the Romanian diaspora’s drift to the far right attributes it to their cultural isolation in their new homes – where social lives exist only through smartphones and sometimes in local Romanian churches. Instead of leaving integration to the labour market and the individual, the EU should encourage people changing countries to take on language classes, perhaps through their employers. One thing more Europeans should do, in the season of Christmas parties, is to invite cleaners, security staff and everyone else working in our offices who may feel invisible to celebrate together, to have a drink and ask them about their lives. These people are usually left out, they are often from other countries, and a small gesture like this can make them feel so much more respected and welcome. Beyond the better integration of migrant workers, if the EU wants to create a stronger and more inclusive European identity, it needs to learn from and compete with Russia’s use of soft power through the entertainment industry. Russian comedy shows like KVN (in which the Ukrainian president Volodymyr Zelenskyy once starred), or the weekly figure-skating programme Ice Age, have been hugely popular – not just in Russia, but across the former Soviet world. Major events like Eurovision and the Champions League may bring Europeans together, but it should not end there. We need more blockbuster shows: what about Europe’s Got Talent, The Voice of Europe, European Top Gear, or The Great European Bake-Off? Why can’t these be broadcast in every EU member and candidate state? If the EU truly wants to get its citizens more involved in processes that once only concerned governments, it needs to drop its dry bureaucratic culture and create more genuine bridges between us – through language, through storytelling, and through the unifying power of culture. Paula Erizanu is a Moldovan journalist and writer based in Chișinău"
commentisfree_2025_dec_05_labour-supporters-child-poverty-honest-about-brexit.txt,opinion,2025-12-05,Gaby Hinsliff,Give credit where it’s due: Labour is finally doing things its supporters actually want,https://www.theguardian.com/commentisfree/2025/dec/05/labour-supporters-child-poverty-honest-about-brexit,"What does it take for a small child not to recognise their own name? I’ve been thinking about that for days, since reading the Local Government Association’s recent report on a growing crisis in early childhood. We’ve known for a while about children starting school still in nappies, or speaking in Americanisms absorbed from hours stuck in front of YouTube, or even struggling to sit upright because they’ve spent too long slumped over an iPad to develop core muscles. So sadly, it’s not surprising to read of early-years workers telling the LGA they see more and more pre-schoolers who can barely speak, play with others or contain their rage when things don’t go their way. But it was the practitioner who noted that some children “don’t seem to respond to their name” who got to me. You have to wonder how often that child hears a loving adult trying to get their attention. Too often, another practitioner said, “children are not spoken to at home, but offered screens all day” – at mealtimes, out shopping, or in the car – with parents seemingly scared of provoking tantrums if they take the phone away. The report describes a complex puzzle with multiple causes: poverty, and the parental exhaustion that comes of a hardscrabble life; growing up in a pandemic; changes in early-years provision; and way too much screen time. It can’t be solved by money alone, but certainly won’t be solved without it. So a two-pronged strategy of lifting the two-child limit on children’s welfare payments – as Rachel Reeves did last week – and intervening early where toddlers aren’t meeting their milestones makes sense. The Best Start family hubs rolling out gradually nationwide will, we learned this week, get Send (special educational needs and disabilities) co-ordinators, focusing particularly on speech and language. They’ll promote the upcoming National Year of Reading to wean kids off screens and on to books, and more generally attempt, on a shoestring, to mimic the support that their predecessor programme Sure Start once offered parents. There’s not enough funding – there never is – but there are the beginnings of joined-up thinking, accepting that tackling problems in nursery rather than in primary school is easier, cheaper and kinder on everyone involved. Let’s not tempt fate, given this government’s unparalleled ability to take one step forward and three back. But for the record: taxing the better-off in the budget to invest in tackling child poverty, telling some home truths about the economic damage done by Brexit (as Keir Starmer also did this week), and striking a zero-tariff deal on pharmaceuticals with Donald Trump to save a lot of jobs isn’t a terrible week at the office. More surprisingly, for the first time in ages Labour is talking about things its supporters actually like. Jobs! Europe! Children not going hungry! Evidently there has been a disturbance in the force. Westminster rumour has it that the Morgan McSweeney tendency inside government – focused on wining voters back from Reform – is currently being out-argued by those more worried about losing them to the Liberal Democrats and the Greens. Who knows whether this will last, or what this will do to their electoral fortunes, so for once let’s stay focused on those at the sharp end. The biggest budget winners in terms of net income, the Resolution Foundation thinktank notes, were the poorest 10%; the biggest losers were the richest 10%. Strip away all the fuss about who leaked what to whom, and there’s the gist: Reeves raised money mostly from the better off and spent it mostly on poorer families. She got there inelegantly but she got there, and now there will be children waking up tomorrow who won’t suffer the lifelong harms of early deprivation. At the time of writing, the government’s imminent child poverty strategy is still under wraps, but children’s charities were unanimous that it would be pointless without scrapping the two-child limit. That’s done. What remains is to tell a compelling human story about how children’s lives will change as a result of all that public money, to make people feel it’s worth it. Of course Nigel Farage will say Labour is whacking up taxes for no good reason. But he backed the lifting of the cap this summer, and Reform has problems of its own. For all its meteoric rise in the polls, it has struggled to break the 30% ceiling – a nice problem to have, admittedly, when you’re still miles ahead of the two supposedly big parties, but 30% isn’t enough to win an election. Hence renewed speculation that Reform will merge with the Tories, which would indeed make sense electorally – if only so many of those involved didn’t hate each other. Meanwhile both Labour and Tory strategists have noticed that Reform’s vote share seemingly falls a bit when the economy is uppermost in people’s thoughts, and rises when immigration is. When the battle is over tax and how to spend it, or where new jobs are coming from, Reform isn’t clear what it wants to say and so loses ground to the Tories. The striking thing about watching Kemi Badenoch pummel Rachel Reeves in parliament last week was how it left Farage oddly out in the cold. Let’s not get carried away here. The chancellor’s path remains strewn with landmines – including a revolt brewing among rural Labour MPs over the increasingly toxic farm inheritance tax – and this administration’s capacity for self-destruction is prodigious. But when a Labour government actually delivers some of what its supporters were screaming for, it’s churlish not to acknowledge it. Sometimes, you just have to take yes for an answer. Gaby Hinsliff is a Guardian columnist"
